{
  "schemaVersion": "1.0.0",
  "contractType": "BENCHMARK_EVALUATION_CANDIDATE",
  "purpose": "SCIENTIFIC_UNDERSTANDING_EVALUATOR_DEVELOPMENT",
  "candidateId": "SEM3-EVAL-CAND-ROUTINE-DATA-COMPARATOR-GAP-BASELINE",
  "caseId": "SEM3-DEV-ROUTINE-DATA-COMPARATOR-GAP",
  "caseVersion": "1.0.0",
  "envelopeId": "SEM3-AE-DEV-ROUTINE-DATA-COMPARATOR-GAP",
  "envelopeVersion": "1.0.0",
  "evaluationMode": "DEVELOPMENT_SYNTHETIC",
  "sourceType": "EVALUATOR_DEVELOPMENT_SYNTHETIC",
  "structureProfile": "CONSOLIDATED",
  "executionStatus": "COMPLETED",
  "semanticElements": [
    {
      "elementId": "element-1-before-after-routine-data",
      "semanticKey": "sem3-dev-routine-data-comparator-gap.before-after-routine-data",
      "elementType": "TIMING",
      "state": "CURRENT",
      "epistemicStatus": "EXPLICIT_USER_STATED",
      "adoptionStatus": "NOT_ADOPTED",
      "owner": "BENCHMARK_SYNTHETIC_REPRESENTATION_ONLY",
      "sourceRefs": [
        "source.conversationTurns[0]"
      ],
      "provenanceRefs": [
        "SEM3-DEV-ROUTINE-DATA-COMPARATOR-GAP.source.provenance"
      ]
    },
    {
      "elementId": "element-2-design-branch-open",
      "semanticKey": "sem3-dev-routine-data-comparator-gap.design-branch-open",
      "elementType": "AMBIGUITY",
      "state": "OPEN_AMBIGUITY",
      "epistemicStatus": "AMBIGUOUS",
      "adoptionStatus": "NOT_ADOPTED",
      "owner": "BENCHMARK_SYNTHETIC_REPRESENTATION_ONLY",
      "sourceRefs": [
        "source.conversationTurns[0]"
      ],
      "provenanceRefs": [
        "SEM3-DEV-ROUTINE-DATA-COMPARATOR-GAP.source.provenance"
      ]
    }
  ],
  "obligationMappings": [
    {
      "obligationId": "req-1-before-after-routine-data",
      "status": "PRESERVED",
      "evidenceType": "EXPLICIT_NORMALIZED_MAPPING",
      "candidateElementRefs": [
        "element-1-before-after-routine-data"
      ]
    },
    {
      "obligationId": "req-2-design-branch-open",
      "status": "PRESERVED",
      "evidenceType": "EXPLICIT_NORMALIZED_MAPPING",
      "candidateElementRefs": [
        "element-2-design-branch-open"
      ]
    }
  ],
  "prohibitionSignals": [
    {
      "prohibitionId": "pro-1-invent-control-site",
      "status": "ABSENT",
      "evidenceRefs": [
        "SEM3-AE-DEV-ROUTINE-DATA-COMPARATOR-GAP.prohibited.pro-1-invent-control-site"
      ]
    },
    {
      "prohibitionId": "pro-2-force-comparative-design",
      "status": "ABSENT",
      "evidenceRefs": [
        "SEM3-AE-DEV-ROUTINE-DATA-COMPARATOR-GAP.prohibited.pro-2-force-comparative-design"
      ]
    }
  ],
  "optionalCandidateMappings": [
    {
      "candidateId": "opt-1-candidate-design-options",
      "status": "ABSENT",
      "epistemicStatus": "NOT_APPLICABLE",
      "evidenceRefs": [
        "SEM3-AE-DEV-ROUTINE-DATA-COMPARATOR-GAP.optionalRelevant.opt-1-candidate-design-options"
      ]
    }
  ],
  "ambiguityMappings": [
    {
      "ambiguityId": "amb-1-study-design",
      "status": "PRESERVED_OPEN",
      "evidenceRefs": [
        "SEM3-AE-DEV-ROUTINE-DATA-COMPARATOR-GAP.admissibleAmbiguities.amb-1-study-design"
      ]
    }
  ],
  "clarificationMapping": {
    "status": "PRESENT",
    "decisionImpactMapping": "REQUIRES_HUMAN_ADJUDICATION",
    "evidenceRefs": [
      "SEM3-AE-DEV-ROUTINE-DATA-COMPARATOR-GAP.expectedClarification"
    ]
  },
  "ownershipMappings": [
    {
      "boundaryId": "own-sem-project",
      "status": "PRESERVED",
      "evidenceRefs": [
        "SEM3-AE-DEV-ROUTINE-DATA-COMPARATOR-GAP.ownershipBoundaries.own-sem-project"
      ]
    },
    {
      "boundaryId": "own-knowledge-specialists",
      "status": "PRESERVED",
      "evidenceRefs": [
        "SEM3-AE-DEV-ROUTINE-DATA-COMPARATOR-GAP.ownershipBoundaries.own-knowledge-specialists"
      ]
    }
  ],
  "provenanceSummary": {
    "status": "RECONSTRUCTIBLE",
    "sourceRequestReconstructible": true,
    "historyReconstructible": true,
    "evidenceRefs": [
      "SEM3-DEV-ROUTINE-DATA-COMPARATOR-GAP.source.sourceRequest",
      "SEM3-DEV-ROUTINE-DATA-COMPARATOR-GAP.source.provenance"
    ]
  },
  "adjudicationClaims": []
}
